{"_doc":"Permission templates for opencode.json agents. Source of truth. _used_by is impact metadata (which agents map to each template) - Refactor-AP S1 (single-mode gentle-ai): auto/auto-sub/semi templates removed; only orchestrator/readwrite/readonly/sddorchestrator/reviewer remain. R11 STRICT PARITY with gentle-ai (docs/mejoras/2026-09-25-permission-parity-gentle-ai.md): per-agent permission deltas neutralized - templates carry structural delegation (task/delegate) only; bash/read/write/edit all inherit the global overlay (bash+read) from opencode-base.json.","_generated":"Run: node scripts/lib/generate-opencode-config.js","_used_by":{"orchestrator":["gentle-MK"],"readwrite":["gentleman-aem","gentleman-aem-sub","gentleman-codex","gentleman-codex-sub","gentleman-deep","gentleman-deep-sub","gentleman-implementer","gentleman-implementer-sub","gentleman-quick","gentleman-quick-sub","sdd-apply","sdd-archive","sdd-design","sdd-explore","sdd-init","sdd-propose","sdd-spec","sdd-tasks","sdd-verify"],"readonly":["gentleman-datascience","gentleman-datascience-sub","gentleman-docs","gentleman-docs-sub","gentleman-frontend","gentleman-frontend-sub","gentleman-infra","gentleman-infra-sub","gentleman-performance","gentleman-performance-sub","gentleman-security","gentleman-security-sub","gentleman-seo","gentleman-seo-sub"],"sddorchestrator":["gentle-orchestrator","sdd-orchestrator"],"reviewer":["gentleman-reviewer","gentleman-reviewer-sub"]},"orchestrator":{"task":{"*":"deny","explore":"allow","general":"allow","gentleman-deep-sub":"allow","gentleman-quick-sub":"allow","gentleman-implementer-sub":"allow","gentleman-security-sub":"allow","gentleman-seo-sub":"allow","gentleman-infra-sub":"allow","gentleman-frontend-sub":"allow","gentleman-performance-sub":"allow","gentleman-datascience-sub":"allow","gentleman-docs-sub":"allow","sdd-apply":"allow","sdd-archive":"allow","sdd-design":"allow","sdd-explore":"allow","sdd-init":"allow","sdd-propose":"allow","sdd-spec":"allow","sdd-tasks":"allow","sdd-verify":"allow","gentleman-aem-sub":"allow","gentleman-codex-sub":"allow"}},"readwrite":{},"readonly":{"task":{"*":"deny"}},"sddorchestrator":{},"reviewer":{}}